QuestionText, QuestionType,Answer1,IsAnswer1Correct,Answer2,IsAnswer2Correct, Answer3,IsAnswer3Correct,Answer4,IsAnswer4Correct,Answer5,IsAnswer5Correct,Answer6,IsAnswer6Correct, Answer7,IsAnswer7Correct,Answer8,IsAnswer8Correct, Answer9,IsAnswer9Correct,Answer10,IsAnswer10Correct,ShowAnswerHint,CorrectToProceed,ShowFeedback
An ID card must be provided by the client for all card transactions over __________,MULTICHOICE,$25 ,FALSE,$50 ,TRUE,$100 ,FALSE,$250 ,FALSE,,,,,,,,,,,,,FALSE,FALSE,
"TRUE / FALSE:There is a different refund policy for POS transactions based on the use.",MULTICHOICE,TRUE,TRUE,FALSE,FALSE,,,,,,,,,,,,,,,,,FALSE,FALSE,
In what order do you accept payment to complete a transaction,MULTICHOICE,Both,FALSE,Neither,FALSE,Finish / Tender -> Accept Payment,FALSE,Accept Paymnet -> Finish / Tender,TRUE,,,,,,,,,,,,,FALSE,FALSE,
How do you attach a client to a pending reciept (Select all that apply)?,MULTICHOICE,"Within the POS module, click ""Customer Search"", enter related identifying information, select the customer name from the list of results",TRUE,"Navigate to ""Customers"", search for the customer name, open the POS module and resume reciept",FALSE,"Keep the current customer as ""Drop-In Customer"" for those who may not have an account or that are purchasing a snack bar item",TRUE,,,,,,,,,,,,,,,FALSE,FALSE,