QuestionText, QuestionType,Answer1,IsAnswer1Correct,Answer2,IsAnswer2Correct, Answer3,IsAnswer3Correct,Answer4,IsAnswer4Correct,Answer5,IsAnswer5Correct,Answer6,IsAnswer6Correct, Answer7,IsAnswer7Correct,Answer8,IsAnswer8Correct, Answer9,IsAnswer9Correct,Answer10,IsAnswer10Correct,ShowAnswerHint,CorrectToProceed,ShowFeedback
"Based on the refund policy, how long does a client have to receive 100% credit back to the credit card account?",MULTICHOICE,They are only eligible for 50% back to their credit card account if the event is 30 days prior to the original rental date.,TRUE,They are never eligible for any refund.,FALSE,30 days prior to the date of the event,FALSE,10 City business days before the scheduled date of the event.,FALSE,,,,,,,,,,,,,FALSE,FALSE,
What is the minimum a client can reserve an area?,MULTICHOICE,No minimum,FALSE,1 Hour,FALSE,2 Hours,TRUE,3 Hours,FALSE,,,,,,,,,,,,,FALSE,FALSE,
"How much is an ""Inflatable Jump Fee""?",MULTICHOICE,$20 per hour,FALSE,$20 Per Jump,TRUE,"$20 per day, per rental",FALSE,No charge for groups under 25 patrons,FALSE,,,,,,,,,,,,,FALSE,FALSE,
"TRUE / FALSE:Once a payment is submitted to a permit, the permit is automatically changed to ""Approved"" status",MULTICHOICE,TRUE,FALSE,FALSE,TRUE,,,,,,,,,,,,,,,,,FALSE,FALSE,
"TRUE / FALSE:When cancelling a permit application, a client is automatically subject to a refund.",MULTICHOICE,TRUE,FALSE,FALSE,TRUE,,,,,,,,,,,,,,,,,FALSE,FALSE,
"TRUE / FALSE:If the permit requires elements out of your knowledge, refer the client to the Reservation Specialist in charge of the requested area.",MULTICHOICE,TRUE,TRUE,FALSE,FALSE,,,,,,,,,,,,,,,,,FALSE,FALSE,